{"complete":true,"counts":{"baseline":2,"baseline_only":0,"candidate":2,"candidate_only":0,"common_keys":2,"matched_exact":2,"matched_with_required_difference":0,"matched_within_tolerance":0},"discrepancy_count":0,"inputs":{"baseline":{"bytes":26,"sha256":"32ff80fd20d1f933aa40977c973a2778d5a4ded6532fbc0a4b035c299d15e975"},"candidate":{"bytes":26,"sha256":"32ff80fd20d1f933aa40977c973a2778d5a4ded6532fbc0a4b035c299d15e975"}},"outcome":"PASS","partition_receipt_version":1,"plan_sha256":"74fb79190b267c42efe153e30273659d058fdc0461a1c45d71dd1428899a84de","policy_sha256":"01f87ddfba281520b927a91d449e6ebb9a362cb32ffb9fc3560022ee107ea97d","route_rows":{"baseline":2,"candidate":2},"staged_bytes":80}
