{"complete":true,"counts":{"baseline":2,"baseline_only":0,"candidate":2,"candidate_only":0,"common_keys":2,"matched_exact":2,"matched_with_required_difference":0,"matched_within_tolerance":0},"discrepancy_count":0,"inputs":{"baseline":{"bytes":39,"sha256":"f4c3877f06c18167150fcc43831f956981646919853750001e3a4b64f747c171"},"candidate":{"bytes":39,"sha256":"f4c3877f06c18167150fcc43831f956981646919853750001e3a4b64f747c171"}},"outcome":"PASS","partition_receipt_version":1,"plan_sha256":"74fb79190b267c42efe153e30273659d058fdc0461a1c45d71dd1428899a84de","policy_sha256":"f605f814d031f9aafa7e983ce10fd332699eaebb56327bc581c750a64d146532","route_rows":{"baseline":2,"candidate":2},"staged_bytes":124}
