{"complete":true,"counts":{"baseline":2,"baseline_only":0,"candidate":2,"candidate_only":0,"common_keys":2,"matched_exact":2,"matched_with_required_difference":0,"matched_within_tolerance":0},"discrepancy_count":0,"inputs":{"baseline":{"bytes":24,"sha256":"21d899b0b23fcbfc9b48ff6b1ae4e758c0164194d61cebcba33d706437e34e46"},"candidate":{"bytes":24,"sha256":"21d899b0b23fcbfc9b48ff6b1ae4e758c0164194d61cebcba33d706437e34e46"}},"outcome":"PASS","partition_receipt_version":1,"plan_sha256":"74fb79190b267c42efe153e30273659d058fdc0461a1c45d71dd1428899a84de","policy_sha256":"71eeb877650d5d3f7b97a1966c0162ccef7f4f6b5c90f12929909cac4c5bd196","route_rows":{"baseline":2,"candidate":2},"staged_bytes":76}
